<?xml version="1.0" encoding="UTF-8"?>
<!-- 2006-03-02 -->
<!-- Copyright James Whitaker, 2006 -->
<!-- Contact: pangloss_ww@yahoo.com -->
<!-- This software may not be modified, reproduced, incorporated into other products or used for commercial purposes in any way without the express written permission of the author.-->

<LayerSet Name="Images" ShowOnlyOneLayer="false" ShowAtStartup="true" xmlns:xsi="http://www.w3.org/2001/XMLSchema-instance" xsi:noNamespaceSchemaLocation="LayerSet.xsd">
		<ImageLayer ShowAtStartup="true">
		<Name>Jupiter Base</Name>
		<DistanceAboveSurface>0</DistanceAboveSurface>
		<BoundingBox>
			<North>
				<Value>90.0</Value>
			</North>
			<South>
				<Value>-90.0</Value>
			</South>
			<West>
				<Value>-180.0</Value>
			</West>
			<East>
				<Value>180.0</Value>
			</East>
		</BoundingBox>
		<TexturePath>http://worldwind25.arc.nasa.gov/baseImages/jupiter_2048x1024.jpg</TexturePath>
		<Opacity>255</Opacity>
		<TerrainMapped>false</TerrainMapped>
		</ImageLayer>
		<QuadTileSet ShowAtStartup="true">
			<Name>Tiled</Name>
			<DistanceAboveSurface>0</DistanceAboveSurface>
			<BoundingBox>
				<North>
					<Value>90.0</Value>
				</North>
				<South>
					<Value>-90.0</Value>
				</South>
				<West>
					<Value>-180.0</Value>
				</West>
				<East>
					<Value>180.0</Value>
				</East>
			</BoundingBox>
			<Opacity>255</Opacity>
			<TerrainMapped>false</TerrainMapped>
			<ImageAccessor>
				<LevelZeroTileSizeDegrees>45.0</LevelZeroTileSizeDegrees>
				<NumberLevels>2</NumberLevels>
				<TextureSizePixels>512</TextureSizePixels>
				<ImageFileExtension>jpg</ImageFileExtension>
				<ImageTileService>
					<ServerUrl>http://worldwind25.arc.nasa.gov/jupiter/jupiter.aspx</ServerUrl>
					<DataSetName>Cassini_Surface</DataSetName>
					<ServerLogoFilePath>Data\Icons\Interface\meatball.png</ServerLogoFilePath>
				</ImageTileService>
			</ImageAccessor>
		</QuadTileSet>
		<ExtendedInformation>
			<ToolBarImage>Add-Ons\Jupiter\Data\Jupiter_Thumb.png</ToolBarImage>
		</ExtendedInformation>

</LayerSet>
